{
  "dataset": "d365-finops-pqu",
  "schema_version": "1.1.0",
  "generated_at": "2026-10-15T04:35:05.363122Z",
  "source": {
    "publisher": "Microsoft",
    "repository": "MicrosoftDocs/dynamics-365-unified-operations-public",
    "branch": "main",
    "file_path": "articles/fin-ops-core/dev-itpro/get-started/quality-updates-schedule.md",
    "commit": "7d86a35169692606d303c21e204ae6032d44d44e",
    "article_url": "https://learn.microsoft.com/en-us/dynamics365/fin-ops-core/dev-itpro/get-started/quality-updates-schedule",
    "raw_url": "https://raw.githubusercontent.com/MicrosoftDocs/dynamics-365-unified-operations-public/7d86a35169692606d303c21e204ae6032d44d44e/articles/fin-ops-core/dev-itpro/get-started/quality-updates-schedule.md",
    "markdown_date": "2026-10-13",
    "sha256": "8431bf5fb97becf088a0eaa4eec8f42cb7f86dcafc7f68f9d4b3d972b5cf1eb0",
    "retrieved_at": "2026-10-13T13:44:17.669863Z"
  },
  "count": 30,
  "records": [
    {
      "pqu_id": "10.0.47-PQU-13",
      "application_version": "10.0.47",
      "pqu_train": "PQU-13",
      "release_number": 13,
      "station": 1,
      "station_label": "Station 1",
      "sandbox_start_date": "2026-09-23",
      "sandbox_end_date": "2026-09-26",
      "production_start_date": null,
      "production_end_date": null,
      "source": {
        "publisher": "Microsoft",
        "repository": "MicrosoftDocs/dynamics-365-unified-operations-public",
        "commit": "7d86a35169692606d303c21e204ae6032d44d44e",
        "url": "https://learn.microsoft.com/en-us/dynamics365/fin-ops-core/dev-itpro/get-started/quality-updates-schedule",
        "raw_url": "https://raw.githubusercontent.com/MicrosoftDocs/dynamics-365-unified-operations-public/7d86a35169692606d303c21e204ae6032d44d44e/articles/fin-ops-core/dev-itpro/get-started/quality-updates-schedule.md"
      }
    },
    {
      "pqu_id": "10.0.47-PQU-13",
      "application_version": "10.0.47",
      "pqu_train": "PQU-13",
      "release_number": 13,
      "station": 2,
      "station_label": "Station 2",
      "sandbox_start_date": "2026-09-28",
      "sandbox_end_date": "2026-10-01",
      "production_start_date": "2026-10-03",
      "production_end_date": "2026-10-04",
      "source": {
        "publisher": "Microsoft",
        "repository": "MicrosoftDocs/dynamics-365-unified-operations-public",
        "commit": "7d86a35169692606d303c21e204ae6032d44d44e",
        "url": "https://learn.microsoft.com/en-us/dynamics365/fin-ops-core/dev-itpro/get-started/quality-updates-schedule",
        "raw_url": "https://raw.githubusercontent.com/MicrosoftDocs/dynamics-365-unified-operations-public/7d86a35169692606d303c21e204ae6032d44d44e/articles/fin-ops-core/dev-itpro/get-started/quality-updates-schedule.md"
      }
    },
    {
      "pqu_id": "10.0.47-PQU-13",
      "application_version": "10.0.47",
      "pqu_train": "PQU-13",
      "release_number": 13,
      "station": 3,
      "station_label": "Station 3",
      "sandbox_start_date": "2026-09-28",
      "sandbox_end_date": "2026-10-01",
      "production_start_date": "2026-10-03",
      "production_end_date": "2026-10-04",
      "source": {
        "publisher": "Microsoft",
        "repository": "MicrosoftDocs/dynamics-365-unified-operations-public",
        "commit": "7d86a35169692606d303c21e204ae6032d44d44e",
        "url": "https://learn.microsoft.com/en-us/dynamics365/fin-ops-core/dev-itpro/get-started/quality-updates-schedule",
        "raw_url": "https://raw.githubusercontent.com/MicrosoftDocs/dynamics-365-unified-operations-public/7d86a35169692606d303c21e204ae6032d44d44e/articles/fin-ops-core/dev-itpro/get-started/quality-updates-schedule.md"
      }
    },
    {
      "pqu_id": "10.0.47-PQU-13",
      "application_version": "10.0.47",
      "pqu_train": "PQU-13",
      "release_number": 13,
      "station": 4,
      "station_label": "Station 4",
      "sandbox_start_date": "2026-10-05",
      "sandbox_end_date": "2026-10-08",
      "production_start_date": "2026-10-10",
      "production_end_date": "2026-10-11",
      "source": {
        "publisher": "Microsoft",
        "repository": "MicrosoftDocs/dynamics-365-unified-operations-public",
        "commit": "7d86a35169692606d303c21e204ae6032d44d44e",
        "url": "https://learn.microsoft.com/en-us/dynamics365/fin-ops-core/dev-itpro/get-started/quality-updates-schedule",
        "raw_url": "https://raw.githubusercontent.com/MicrosoftDocs/dynamics-365-unified-operations-public/7d86a35169692606d303c21e204ae6032d44d44e/articles/fin-ops-core/dev-itpro/get-started/quality-updates-schedule.md"
      }
    },
    {
      "pqu_id": "10.0.47-PQU-13",
      "application_version": "10.0.47",
      "pqu_train": "PQU-13",
      "release_number": 13,
      "station": 5,
      "station_label": "Station 5",
      "sandbox_start_date": "2026-10-12",
      "sandbox_end_date": "2026-10-15",
      "production_start_date": "2026-10-17",
      "production_end_date": "2026-10-18",
      "source": {
        "publisher": "Microsoft",
        "repository": "MicrosoftDocs/dynamics-365-unified-operations-public",
        "commit": "7d86a35169692606d303c21e204ae6032d44d44e",
        "url": "https://learn.microsoft.com/en-us/dynamics365/fin-ops-core/dev-itpro/get-started/quality-updates-schedule",
        "raw_url": "https://raw.githubusercontent.com/MicrosoftDocs/dynamics-365-unified-operations-public/7d86a35169692606d303c21e204ae6032d44d44e/articles/fin-ops-core/dev-itpro/get-started/quality-updates-schedule.md"
      }
    },
    {
      "pqu_id": "10.0.47-PQU-13",
      "application_version": "10.0.47",
      "pqu_train": "PQU-13",
      "release_number": 13,
      "station": 6,
      "station_label": "Station 6",
      "sandbox_start_date": "2026-10-12",
      "sandbox_end_date": "2026-10-15",
      "production_start_date": "2026-10-17",
      "production_end_date": "2026-10-18",
      "source": {
        "publisher": "Microsoft",
        "repository": "MicrosoftDocs/dynamics-365-unified-operations-public",
        "commit": "7d86a35169692606d303c21e204ae6032d44d44e",
        "url": "https://learn.microsoft.com/en-us/dynamics365/fin-ops-core/dev-itpro/get-started/quality-updates-schedule",
        "raw_url": "https://raw.githubusercontent.com/MicrosoftDocs/dynamics-365-unified-operations-public/7d86a35169692606d303c21e204ae6032d44d44e/articles/fin-ops-core/dev-itpro/get-started/quality-updates-schedule.md"
      }
    },
    {
      "pqu_id": "10.0.47-PQU-14",
      "application_version": "10.0.47",
      "pqu_train": "PQU-14",
      "release_number": 14,
      "station": 1,
      "station_label": "Station 1",
      "sandbox_start_date": "2026-10-07",
      "sandbox_end_date": "2026-10-10",
      "production_start_date": null,
      "production_end_date": null,
      "source": {
        "publisher": "Microsoft",
        "repository": "MicrosoftDocs/dynamics-365-unified-operations-public",
        "commit": "7d86a35169692606d303c21e204ae6032d44d44e",
        "url": "https://learn.microsoft.com/en-us/dynamics365/fin-ops-core/dev-itpro/get-started/quality-updates-schedule",
        "raw_url": "https://raw.githubusercontent.com/MicrosoftDocs/dynamics-365-unified-operations-public/7d86a35169692606d303c21e204ae6032d44d44e/articles/fin-ops-core/dev-itpro/get-started/quality-updates-schedule.md"
      }
    },
    {
      "pqu_id": "10.0.47-PQU-14",
      "application_version": "10.0.47",
      "pqu_train": "PQU-14",
      "release_number": 14,
      "station": 2,
      "station_label": "Station 2",
      "sandbox_start_date": "2026-10-12",
      "sandbox_end_date": "2026-10-15",
      "production_start_date": "2026-10-17",
      "production_end_date": "2026-10-18",
      "source": {
        "publisher": "Microsoft",
        "repository": "MicrosoftDocs/dynamics-365-unified-operations-public",
        "commit": "7d86a35169692606d303c21e204ae6032d44d44e",
        "url": "https://learn.microsoft.com/en-us/dynamics365/fin-ops-core/dev-itpro/get-started/quality-updates-schedule",
        "raw_url": "https://raw.githubusercontent.com/MicrosoftDocs/dynamics-365-unified-operations-public/7d86a35169692606d303c21e204ae6032d44d44e/articles/fin-ops-core/dev-itpro/get-started/quality-updates-schedule.md"
      }
    },
    {
      "pqu_id": "10.0.47-PQU-14",
      "application_version": "10.0.47",
      "pqu_train": "PQU-14",
      "release_number": 14,
      "station": 3,
      "station_label": "Station 3",
      "sandbox_start_date": "2026-10-12",
      "sandbox_end_date": "2026-10-15",
      "production_start_date": "2026-10-17",
      "production_end_date": "2026-10-18",
      "source": {
        "publisher": "Microsoft",
        "repository": "MicrosoftDocs/dynamics-365-unified-operations-public",
        "commit": "7d86a35169692606d303c21e204ae6032d44d44e",
        "url": "https://learn.microsoft.com/en-us/dynamics365/fin-ops-core/dev-itpro/get-started/quality-updates-schedule",
        "raw_url": "https://raw.githubusercontent.com/MicrosoftDocs/dynamics-365-unified-operations-public/7d86a35169692606d303c21e204ae6032d44d44e/articles/fin-ops-core/dev-itpro/get-started/quality-updates-schedule.md"
      }
    },
    {
      "pqu_id": "10.0.47-PQU-14",
      "application_version": "10.0.47",
      "pqu_train": "PQU-14",
      "release_number": 14,
      "station": 4,
      "station_label": "Station 4",
      "sandbox_start_date": "2026-10-19",
      "sandbox_end_date": "2026-10-22",
      "production_start_date": "2026-10-24",
      "production_end_date": "2026-10-25",
      "source": {
        "publisher": "Microsoft",
        "repository": "MicrosoftDocs/dynamics-365-unified-operations-public",
        "commit": "7d86a35169692606d303c21e204ae6032d44d44e",
        "url": "https://learn.microsoft.com/en-us/dynamics365/fin-ops-core/dev-itpro/get-started/quality-updates-schedule",